,asin,title,description,also_buy,also_view,brand,Category1,Category2,Category3,Category4,avg_rating
181,B00OUO3JSW,LCD display Touch Screen Digitizer Assembly for Samsung Galaxy Note 4 N910 N910S N910C N910A N910V N910P N910R N910T with free tools (White),"['<br>LCD display Screen Touch Digitizer for Samsung Galaxy Note 4 N910 N910S N910C N910A N910V N910P N910R N910T <br> <br>Description: <br>This full set LCD & touch screen digitizer glass assembly is compatible For Samsung Galaxy Note 4 N910 N910S N910C N910A N910V N910P N910R N910T <br>Replacement part for your cracked or broken screen. <br>Pre-assembled, easy for your installation. <br> <br>Package Included: <br>1 x LCD Display Glass <br>1 x Touch Screen Digitizer <br>1 x Opening Tools Kit']","B00SCWE05Y,B018FXD8JI",,TheCoolCube,Cell Phones & Accessories,Accessories,Replacement Parts,,0.786525
182,B00OY57EIS,Tech Armor HYBRID Edge to Edge Glass (.2mm) Screen Protector for Apple iPhone 6 Plus/6s Plus [Blk] [1-pack],"['. WHY SHOULD YOU BUY TECHARMOR HYBRID BALLISTIC GLASS SCREEN PROTECTORS . MAXIMIZE RESALE VALUE WITH FUSED TECHNOLOGY. DID YOU KNOW a broken iPhone 6 Plus screen is expensive to replace. Where other full coverage options are prone to shatter on impact, this first to market design combines the HD Clarity of our Premium Tempered Ballistic Glass with the shock absorbing power of a polymer edge. This blend cushions against impact and distributes force evenly, keeping your screen and its protection intact while our molded perfect fit edges, with silicone adhesive, prevent the build up of dirt/debris to eliminate peeling. No detail has been overlooked with this Best In Class product from Tech Armor, industry leader in screen protection. If you only accept the BEST then look no further: BEST Edge to Edge Screen Coverage. BEST Protection from Drops/Scratches. BEST HD Clarity. BEST Touch Accuracy. BEST No Bubble Installation. COMPATIBILITY: Apple iPhone 6S Plus / iPhone 6 Plus (5.5 inch ONLY), All Carriers, All Models (NOTE: Hybrid E2E Glass works with ALL Tech Armor brand cases and most competitor brand cases. For particularly snug cases standard Tech Armor Ballistic Glass may be a better solution.) The Hybrid Edge to Edge Ballistic Glass Screen Protector Kit Includes: One (1) Edge to Edge Hybrid Glass Screen Protector (.3mm 9H Rating), Installation Instructions, Alcohol Cleaning Wipe, Microfiber Cloth, Dust Removal Tape, Retail Packaging, and The Tech Armor Limited Lifetime Replacements.']","B01JJLJC9K,B00EL94RQE,B076HCRH2N,B00SY62VKE,B01JJLK5M8,B01D221FWE,B00GPAFHIO,B00BT8L2MW,B01JJLJ3BC,B01LS5JPPG,B01D221GPA,B074SX97LS,B00N28AUK2,B01CPJLTNA,B01BE1D8W0,B00OY57A32,B00QZRYLBQ,B00NGMVD8W,B013W2Q6E6",,Tech Armor,Cell Phones & Accessories,Accessories,Screen Protectors,,0.77825
183,B00P1N5OQQ,Tech21 Impact Tactical Case Cover for LG G3 - Blue,"['Outstanding impact protection for the back and sides of your valuable device in a minimalistic, stylish design']",,,tech21,Cell Phones & Accessories,"Cases, Holsters & Sleeves",,,0.851575
184,B00P674O6I,Black New lens Touch Screen Digitizer For LG G Vista VS880 D631 USA Cell Phones Parts,"['Package include: 1pcs New Touch Screen Digitizer For LG G Vista VS880 D631. 1) Please confirm the item is exactly one you need. If the buyer bought a wrong item, not need the item, can not install the item, or any other buyers causes returns, buyer need to pay for the return shipping and 15% of payment for the seller charge(Example: shipping fee, Restocking fee, Handling charges and so on.) 2) Do not install the item immediately after received. Please try to check the item function by just plug the flex connector to your phone firstly. Please make sure to test it first. Determining quality is fine, work properly, no scratches and then installed. Once after installed, would no longer accept returns. Thank you for your cooperation.']","B01CN5C57A,B00BXYWXY8,B00VO39BUM,B00M9EVMUW,B01HTG77CQ,B01N48V9UP,B01N0TLFNG,B01HLYI35G,B00WF7VCPS,B017R80E2Q,B01M0DVNBM,B012HES724,B01E5ER0TU,B019OQ4YWK,B01M0MWIMB,B00H99Y9GQ,B01F5CO7S8,B015FHJZR6,B01M8ICMKV,B072JTR5W4,B00H3DZRXC,B071QYHRQ6,B017B9KB6U,B01MAYP0YN,B00XBAZNTO,B00T8KYUEU,B015FK4Y38","B017R80E2Q,B00XBAZNTO,B01HLYI35G,B00T8KYUEU,B00M4GBQJM,B07GJV5YSX,B01HTG77CQ,B01N0617IZ,B07GH2J1VG",CE CENTAURUS ELECTRONICS,Cell Phones & Accessories,Accessories,Replacement Parts,,0.786525
185,B00PC6MNV6,HTC butterfly Verizon Droid DNA Black lcd screen+touch panel digitizer assembly (verizon logo) ~ USA,"['HTC Verizon Droid DNA lcd screen display + Touch panel digitizerblack (original) with ""verizon"" logo Payment: Paypal,Moneybookers,online banking TT (HSBC,E-Trade). Shipment: USPS with tracking number (http://www.usps.com/) Guarantee: 30 days return policy ( item arrived broken or not working ) Refund given as Money back or exchange']",,,HTC,Cell Phones & Accessories,Accessories,Replacement Parts,,0.806475
186,B00PIFWZAA,CASEFORMERS Duo Armor RED for LG Tribute Combo Case with Stand and Holster,"['<b>A leader in protective shock-absorbing cases</b> \n<br> \n<br> The CASEFORMERS Duo Armor Case and Holster offers your LG Tribute the best in protection while throwing extra features like a adjustable belt clip and an independent kickstand. \n<br> \n<br> \n<b>Combining comfort and durability</b> \n<br> \n<br> Our CASEFORMERS Duo Armor Case protects your LG Tribute with shock absorbing layer to deal with those nasty drops, while a hard exoskeleton layer adds a stiffness that protects all the internal parts. This case feels great in your hands as your fingers wrap around all the grooves and the soft silicon for a tight grip. The precise cutouts provide full access to all your LG Tribute buttons, jacks, and features. This Duo Armor Case also features two viewing stands for hands free viewing. \n<br> \n<br> \n<b>Caseformers Highlights:</b> \n<br> \n<br>  Shock absorbing layer protects from drops \n<br>  Hard shell provides a barrier against scratches and bumps \n<br>  Striking groove design for more style and grip \n<br>  2 viewing stands: one on the case, and an adjustable stand on the holster \n<br>  Fully adjustable belt clip \n<br>  Precise cutouts for all buttons, jacks, and features']",,,CASEFORMERS,Cell Phones & Accessories,"Cases, Holsters & Sleeves",Basic Cases,,0.789825
187,B00PQ9434Y,LCD Display Touch Screen Digitizer W/Frame Assembly for Nokia Lumia 630 635,[],,,"Shenzhen BaiYiTong Electronic Co.,LTD",Cell Phones & Accessories,Accessories,Replacement Parts,,0.786525
188,B00PQBN2BM,Generic New Touch Screen Digitizer + LCD Display Assembly for Oneplus One 1+ A0001,['Generic New Touch Screen Digitizer + LCD Display Assembly for Oneplus One 1+ A0001'],"B00BXYWXY8,B00E3CHLLC,B00P20JLAI,B00LWSRVN8,B01K7F4OAY,B076J7WB42,B072WP4NX3,B013QOYTBC,B0741PG5T8,B00LASRKDG,B00UTMKHZM,B01LWOYYYZ,B00V9UBOSW,B01M7YXIIS,B01IN5V75U,B00Q2ZW3IO,B01M327HSN,B00BXYWXV6,B06XDXY25L,B01H3PEWDK,B01LYX1P0E,B01MQEBCCE,B01MQE8U68,B079TV99LM,B00UA4E2M8,B00U3MR9JU,B00KQKATH8,B00MBS1NA0,B01G1CZXIE",,ProMaxi,Cell Phones & Accessories,Accessories,Replacement Parts,,0.7163
189,B00PSNUC70,"ExPoint, Samsung Galaxy S5, LCD and Digitizer Screen Replacement, 1 Year Warranty and Phone Support - Black","['Replacement black LCD/digitizer screen assembly for the Samsung Galaxy S5. Compatible with all US Samsung Galaxy S5 phones - Verizon (G900V), Sprint (G900P), US Cellular (G900R), AT&T (G900A) and T-Mobile (G900T).']","B0188YRD1I,B01M7PBVMP,B01M9A621X,B01M63O7DZ,B01CRUKD20,B00IT5PEZO,B01M6WH6NG,B01CMFTS2Q",,ExPoint,Cell Phones & Accessories,Accessories,Replacement Parts,,0.806475
190,B00PWBPSNQ,"iPhone 5S Case, iPhone 5 Case, AUMIAU Dual Layer Hybrid Luxury Fashion Shockproof Soft Hard Case Cover for Apple iPhone 5/5S","['<b>Features and specifications:</b> <br> <br>Beautiful and Unique pattern iPhone 5 5S SE case. <br>The case was combined with two parts, the inner soft silicone cover and a hard plastic outside cover. <br>Perfect cutouts allow you to maximize the functionality of your phone. <br>Simple luxury and personalized design, to make your iPhone to be only fashion, and bring you unforgettable experience. <br> <br> <b>Package contents:</b> <br> <br>1 x AUMIAU Dual Layer Hybrid Case Cover For iPhone 5 5S SE']",,,AUMIAU,Cell Phones & Accessories,Accessories,,,0.804425
191,B00PWBVYYS,"iPhone SE Case, iPhone 5S Case, iPhone 5 Case, AUMIAU Ultra Slim Hybrid 3 Color Shockproof Soft TPU Hard PC Bumper Protective Case Cover for Apple iPhone 5S/5/SE (Green)","['<b>Features and specifications: </b> <br>100% Brand New and good quality. <br>Represent your luxury and elegance to become the center of attention . <br>Perfect fit for your Apple iPhone SE/5S/5 SmartPhone. <br>Access to all buttons and controls, no need to remove when charging, plugging in, adjusting volume or switching on/off. <br>Protecting your phone from scratches, dust, shock and fingerprint. <br> <br><b>Package contents: </b> <br> <br>1x iPhone SE/5S/5 SmartPhone Case in Retail Package']",,"B06XC1ZD57,B00FEDRJ1G,B01MA505HT",AUMIAU,Cell Phones & Accessories,Accessories,,,0.8011999999999999
192,B00QTGVH2E,Flashtechllc 4.7 Inch LCD Display Touch Digitizer Screen Replacement Assembly for iPhone 6,[],,,Generic,Cell Phones & Accessories,Accessories,Replacement Parts,,0.7965
193,B00R6XAK36,iPhone 5S / 5C Battery : Stalion Strength Replacement Li-Ion Polymer Battery 1560mAh 3.8V for iPhone 5S &amp; iPhone 5C [24-Month Warranty](Compatible with GSM &amp; CDMA Models),"['', '<strong>Stalion&reg; Strength</strong>', 'Premium replacement lithium polymer ion battery that is designed specifically for your Apple iPhone 5s and/or iPhone 5c. The equivalent OEM specification of part number APN:&nbsp;616-0667, 616-0719, 616-0720, or 616-0722 battery is a quick fix that will revive your iPhone if you suffer from a quickly draining battery. The Li-ion polymer battery is equipped with flex cable to fit your model iPhone 5S (Touch ID) or 5C (Colored) and bring it back to life. All Stalion Batteries are CE and ROHS certified.', '<strong>Product Features</strong>', 'Battery Specs: Capacity: 1560mAh, Battery type: Lithium Ion, Voltage: 3.8 Li-ion. Duration: 5.92Wh', '<strong>Compatibility</strong>', 'Apple iPhone 5S: A1533, A1457, A1530 (AT&amp;T, T-Mobile-GSM), A1533, A1453 (Verizon, Sprint- CDMA)<br />Apple iPhone 5C: A1532, A1507, A1529 (AT&amp;T, T-Mobile- GSM), A1532 or A1456 (Verizon, Sprint-CDMA)', '<strong>Installation</strong>', 'Requires a moderate level of expertise to install the replacement; if you need assistance please refer to our YOUTUBE Channel for instructional videos. Tools are NOT included', '<strong>Warranty </strong>', '24-Month (2 Years)', '<strong>Support </strong>', 'Call Mon-Fri 10AM-6PM&nbsp;EST or email anytime!', '&nbsp;']",B00XZB3WKQ,"B00XZB3WKQ,B01MXV18NC,B07GH2BFS9,B07HXTFRD4,B076M3PPMD,B07GYSQQZY,B07GC2NMZ5,B01HPXAB4O,B0743731MS,B07CCZKWV7",Stalion,Cell Phones & Accessories,Accessories,Batteries & Battery Packs,Replacement Batteries,0.8076
194,B00RHH8J16,EverGoods Sometimes You Gotta Fall Quote Ocean Hard Case Cover for Samsung Galaxy S3 S III I9300,['EverGoods Sometimes You Gotta Fall Quote Ocean Hard Case Cover for Samsung Galaxy S3 S III I9300'],,,,Cell Phones & Accessories,"Cases, Holsters & Sleeves",Basic Cases,,0.8238
195,B00RIHOZLI,Generic LCD Touch Screen Digitizer Assembly with Frame for Samsung Galaxy S4 (SIV) GT- I9500 (International) (for Mobile Phone Repair Part Replacement)(Free Repair Tool Kits) (White Frost),"['Have you dropped your Samsung Galaxy S4 and damaged the touch screen, interfering with images? Has it otherwise become scratched or scuffed? \n<br /> \n<br /> If your Samsung Galaxy S4 had damage done to the screen, or if you are having display issues that cause a white or black screen or inky spots that interfere with pictures and other images, \n<b>you do not have to replace the entire Samsung phone. </b> \n<br /> \n<br /> For a fraction of the cost, this LCD display and touch screen digitizer assembly replacement can repair a damaged touch screen and the LCD display at the same time. This complete front assembly will allow you to see images clearly again, without inky spots or scratches to the touch screen. If your touch screen is not responding properly, this assembly can also replace a broken touch screen, and for a fraction of the cost of a new Samsung Galaxy S4. \n<br /> \n<br /> If you&apos;re not good at repairing, you&apos;d better ask someone who is skilled to do this for you. Or search the internet and find some tutorial video for reference. \n<br /> \n<br /> Its vital to know the difference among GS4 model variants when you need to buy a suitable Galaxy S4 replacement part to fix your broken Galaxy S4 \n<br /> \n<br /> \n<b>There are four ways how to know which Galaxy S4 model name you have.</b> \n<br /> Find Samsung Galaxy S4 Model Number in the system (Navigate to Setting&gt;About) \n<br /> Know Galaxy S4 Model Name from Battery Door \n<br /> Find Galaxy S4 Model Number behind the Battery \n<br /> Check Samsung Galaxy S4 Model Code under the Housing \n<br /> \n<br /> \n<b>Each screen is tested before shipping and 100% working, Ships safely with box packaging.</b> \n<br /> \n<br /> \n<b>Package as included: <br /> *LCD Touch Screen Digitizer <br /> *Repair Tool Kits(Philips Head / Flat Head / 5-angel star head / Pry Pick / Suction cup / Tweezers ) <br /> *Gift: New Middle Plate Silver Frame (Replace the middle plate if your phone edge is damaged)</b>']",,,Generic,Cell Phones & Accessories,Accessories,Replacement Parts,,0.773225
196,B00RR5CNWY,ArmorSuit MilitaryShield - LG G4 Screen Protector Anti-Bubble Ultra HD - Extreme Clarity &amp; Touch Responsive Shield with Lifetime Replacement Warranty,"['', ""<b>Military Grade Protection</b><br> <br> ArmorSuit MilitaryShield features exceptional clarity and UV protection to prevent yellowing. It is made from the same protective film material used to protect military aircrafts, helicopters and space shuttles. MilitaryShield is also equipped with &quot;self-healing&quot; properties to maximize the protection. The self-healing technology works to constantly eliminate minor scratches on the film. All of our MilitaryShield are uniquely designed to provide a perfect cut for a perfect fit on your device. It also features corrosion and moisture protection to prevent substances from migrating through the film to attack underlying substrates. It's designed to provide daily protection against scratches and reduce chances of damage to your screen from impact forces and drops. Best of all, it's very easy to apply.<br> <br> <b>Lifetime Replacement Warranty</b><br> <br> If your MilitaryShield peels off, becomes scratched or damaged, or has installation flaws, we will gladly replace the product FREE OF CHARGE no matter what the issue is.<br> <br> <b>Package Contents</b><br> <br> MilitaryShield for your device<br> Flexible Squeegee<br> Spray Bottle Solution<br> Microfiber Cloth<br> Installation Instructions<br> <br> If you ever need to <b>remove</b> the MilitaryShield, simply peel it off slowly with your bare hands. It will come off clean without any sticky residue.<br> <br> <b>*Made in the USA*</b><br> &nbsp;""]","B0774KB77K,B01JU430SU,B00K2CYY44,B01BW6QEMI,B00X0X2ZOI,B00XJS2O0E,B01ACXSKAG,B00ELUMX6E",,ArmorSuit,Cell Phones & Accessories,Accessories,Screen Protectors,,0.7763
197,B00RV7TQ3C,"HTC Desire 510, COVRWARE 3 in 1 Bundle - Heavy Duty Terrapin Series Armor Protective Case with Built-in Kickstand [HD Film &amp; Aluminum Sensitive Cap Stylus Pen] - Green","['<b>Compatible with HTC Desire 510</b> \n<br> \n<br>', '<b>Terrapin Series Armor Protective Case with Kickstand Case<br> </b><br> Offer great protections for your phone<br> Provides easy access to touchscreen, camera, buttons, and ports<br> Easy fit and convenient installation<br> Dual layer provides the strongest level of protection<br> Double protection- hard outer shell with TPU inner layer', '<b>Crystal Clear Premiun Screen Protector</b>', 'Protect your screen from scratch<br> Precisely cut to fit devices screen<br> Maximum Screen Coverage and sized for easy installation', '<b>Aluminum Ultra-Sensitive Capactive Cap Stylus Pen</b>', 'Using the lastest technology, fits in your hand like a pen, provide a smooth pen like writing experience for your touch screen tablet or phone<br> Compact and light weight design, easy to carry.<br> High Quality sift tip protects your screen from fingerprints and scratches<br> Features a 3.5mm headphone jack insert so you never have to worry about lose your stylus!<br> Compatible all capacitive touch screen devices', '<b>COVRWARE is a registered trademark protected by US Trademark Law.</b>']",,,COVRWARE,Cell Phones & Accessories,Accessories,Accessory Kits,,0.806475
198,B00SAU4ZSA,"iPhone 6S Case, technext020 Non-Slip Perfect-Fit iPhone 6 6S (4.7) Case Hard Plastic Silicone Protective Case Rubber Bumper Slim Heavy Duty Dual Layer Gold Cover for iPhone 6 (2014) and iPhone 6S (2015)",[],"B00SAU4S64,B00SAU4Q0C",,technext020,Cell Phones & Accessories,"Cases, Holsters & Sleeves",,,0.7375750000000001
199,B00SC4SETA,LG G3 Tempered Glass Screen Protector: Amplim Premium Front 9H Crystal Clear HD Anti Fingerprint &amp; Smudge Scratch Proof Bubble / Halo Free Cover. Case Friendly Shield,"['Amplim Pellucid Alloy G3 for LG G3 rounded edges screen protector is ULTRA SLIM, SCRATCH PROOF (9H Hardness) - will not be scratched by coins, keys or knives, and provides CRYSTAL-CLEAR PROTECTION with NO INTERFERENCE on LG G3 touch screen. OLEOPHOBIC COATING resists oils and reduces smudges and fingerprints.']",,,Amplim,Cell Phones & Accessories,Accessories,Screen Protectors,,0.8372999999999999
200,B00SFGXLJI,"iPhone 6s Case, Slicoo&reg; [Lifetime Warranty] Dual-layer TPU Rubber Protective Carrying Cover Case for iPhone 6 6s (4.7 inch) (Pink)","['<b>iPhone 6 Case</b> <br> <br> <b>About Slicoo</b> <br>Slicoo is a professional brand specialized for design and manufacture of protective cases. <br>Our case combines high-quality material and sophisticated technology to provide perfect experience for users. <br>We are dedicated to provide stylish, good-looking yet durable cases to our customers. <br> <br> <b>Description</b> <br>This dual-layer protective case is specially designed for iPhone 6 6s (4.7 inch) to provide full-around protection and decoration. <br>Made of environment friendly TPU rubber and electroplated plastic, it is safe to use and easy to install and remove. <br> <br> <b>Features</b> <br>- Precisely fits the contour of iPhone 6 6s (4.7 inch) <br>- High quality material, comfortable to the touch <br>- Cut-out back to show your Apple logo on your iPhone <br>- Direct external access to all buttons, ports and controls <br>- Dual-layer case with bright color contrast <br> <br> <b>Package Included</b> <br>1* iPhone 6 Case']",,,Slicoo,Cell Phones & Accessories,"Cases, Holsters & Sleeves",,,0.894425
201,B00SKQ47DM,LCD display Touch Screen Digitizer Assembly for Samsung Galaxy Note 4 N910 N910S N910C N910A N910V N910P N910R N910T with free tools (Gold),"['<br />LCD display Screen Touch Digitizer for Samsung Galaxy Note 4 N910 N910S N910C N910A N910V N910P N910R N910T \n<br /> \n<br />Description: \n<br />This full set LCD &amp; touch screen digitizer glass assembly is compatible For Samsung Galaxy Note 4 N910 N910S N910C N910A N910V N910P N910R N910T \n<br />Replacement part for your cracked or broken screen. \n<br />Pre-assembled, easy for your installation. \n<br /> \n<br />Package Included: \n<br />1 x LCD Display Glass \n<br />1 x Touch Screen Digitizer \n<br />1 x Opening Tools Kit']",,"B00PAPZKOQ,B013QOBWG2,B071KBBJYV,B01CE0MST4,B06ZZBVR6Y,B00PWF9IJC,B013QOBWC6,B018FXD6RM,B00DUR2GZM,B00R8WRLJG,B00PYN5XOQ,B071DF2PN3,B00N532FRU,B0743BNFZB,B015SAKQRS,B01HBUTLR4,B00PHJI28G,B01E9ILNUE,B00NF4SOFQ,B00NF4T0I6,B01LW0UDSP,B00NWE8440,B00NF4SV68,B00Q4HQP5M,B018FXD8JI,B07GGZM7B6,B014PQBFWQ,B07FQ3Q4RK,B076Q6PYQB,B01MQTL7HI,B01N36S28I,B00NF4SWLW,B01MSUIDDK,B00NKRDCFA,B07G766NY3,B01CPIYNQG,B00NKRE7MW,B01595SI9U,B00TRPT8I4,B076Q9QYT5,B00RKN0H44,B00NG25FAE,B00SCXLRBS,B07D7QCLQ8,B07GZMPT2T,B07GZMY855,B00TKUKQ4G",TheCoolCube,Cell Phones & Accessories,Accessories,Replacement Parts,,0.786525
202,B00SL9DA0O,LCD display Touch Screen Digitizer Assembly Replacement Part for Samsung Galaxy S5 i9600 G900R G900F G900H G900M G9001 + Free tools Black,"['Compatible with:Samsung Galaxy S5 i9600 G900R G900F G900H G900M G9001 <br />Features: <br /> 1.LCD Display Glass Touch Screen Digitizer Assembly. <br /> 2.High Quality LCD Display Glass Touch Screen Digitizer Assembly Replacement. <br /> 3.Repair/Replacing old ,broken,cracked,damaged LCD Display Glass Touch Screen Digitizer Assembly. <br /> 4.Each item is tested before shipping. <br /> 5.packed safely in bubble wrap+box. <br />Notice: <br /> We are not responsible for any damage caused by installation of this accessory.We suggest you are familiar or seek a professional for dismantling your device,or otherwise you may damage or break your device. <br /> Instructions and tools not supplied as part of the auction. <br />Attention: <br /> 1.We Offer of accessories for all Apple products, Samsung phones and other tablets accessories. We are dedicated to creating products that provide our Amazon customers satisfaction beyond expectations. <br /> 2.Our pursuit is to make an easy and pleasant shopping environment for our respected customers. Your recognization will encourage us greatly and serve you better. <br /> 2.We ship from China,it takes about 7-15 days for the delivery,pls wait for your item with patience,thank you!']","B00UYHSUWO,B00BXYWXY8,B06Y5J2J6W,B06Y5J8DGN,B0722GF7S2,B0784FJ6R2,B01JCQGWSQ,B075CNCPRQ,B00YG6H4XA,B072XPP3QZ,B00KAHZF2G,B01N6N953A,B07B718WNY,B00MVFAZ2A,B07BLRWVNT,B00K4VZNBG,B01EXJAW2E,B07B437TY1,B00YXGS5ZE,B00JWINAJE,B06XF4BLK9,B07B7DTD8R,B00E5NHYP2,B076M3PPMD,B00KC4SLLY,B0755BKTWQ,B00UYHSUTW,B00KFKS9H6,B00LYXTLQG,B00XJ56AC0,B01IN54IY2,B076QG3FBD,B06XVTHDNL,B00L5CFLT2,B075DD2ZYR,B00E5NFVS4,B077KSYVVT,B074T89T2H,B075P1ZVRP,B07113SHLT,B07BS6PBQ8,B079G8JHNZ,B01N7O4HZF,B01NCRW645,B075P3XXY8,B078PQNR9V,B073QMLLRG,B071PFCTGQ,B06XDLPLMY,B075P3583T,B01CMFTOTS,B01KZE99Q6,B06XSY1RGS,B00R3IHYI8,B0714J3HXY,B00XWCH664,B01FXIO8DI,B0796BFFQY,B01BY9GQ8K,B01EFG8AHE",,hongkongruly,Cell Phones & Accessories,Accessories,Replacement Parts,,0.786525
203,B00SMFAN20,Full LCD Touch Screen Digitizer Assembly Replacement for Iphone 5s (Black),"['Compatible with:iPhone 5S <br> Features: <br> 1.LCD Display Glass Touch Screen Digitizer Assembly. <br> 2.High Quality LCD Display Glass Touch Screen Digitizer Assembly Replacement. <br> 3.Repair/Replacing old ,broken,cracked,damaged LCD Display Glass Touch Screen Digitizer Assembly. <br> 4.Each item is tested before shipping. <br> 5.packed safely in bubble wrap+box. <br> Notice: <br> We are not responsible for any damage caused by installation of this accessory.We suggest you are familiar or seek a professional for dismantling your device,or otherwise you may damage or break your device. <br>Attention: <br> 1.We Offer of accessories for all Apple products, Samsung phones and other tablets accessories. We are dedicated to creating products that provide our Amazon customers satisfaction beyond expectations. <br> 2.Our pursuit is to make an easy and pleasant shopping environment for our respected customers. Your recognization will encourage us greatly and serve you better.']","B00JK9HXLQ,B00XSY48Z8,B00H4W9U8U,B00IT5PEZO,B00HFEBS8W,B06XW8FMW7,B01CG8JAIQ,B01GPY9N5W,B01GPXZY88,B00X6SQX5Y,B01N0V4LIW,B01KZHAH28,B01KZGJQ62,B00KVO3Z8E,B00KVO3Z9I,B00LI17FYO,B00VJVM7U0,B01MY2IKCX,B077NBRW51,B01ETE5QHE,B00MRAYNGI,B06X94HL6P,B00IT5PF8U,B07256ZSFZ,B00WUAEFW2,B06W5JNTPR,B01EL96W1G,B01CMFTOTS,B072MRB4X4,B07F7RPP5V,B0756XCNN7,B07547DZJK,B01KZHA88G",,hongkongruly,Cell Phones & Accessories,Accessories,Replacement Parts,,0.806475
204,B00SX1NN9I,Rearth Ringke Slim Full Top and Bottom Coverage Premium Dual Coated Hard Case for iPhone 6 - Retail Packaging - Gunmetal (Logo Cut Out),"['Ringke SLIM has a perfect fitting style with full top and bottom with tapered lip and lifted camera bezel that raises your phone to a comfortable height off the surface. This keeps the screen safe and protected while providing comfort in your hand. Ringke SLIM also offers the perfect natural grip design by our original efficiency engineering as well as a new Enhanced Dual Coating Technology for 2x longer lasting durability. Dual coating allows for easy pocket removal and enhanced coating allows you to wipe away dusts and oil easily. Ringke SLIM is created with extreme precision for each cut out. Therefore, you will have easy access to all the ports and buttons of your device. Perfect natural grip design is made to put your comfort as priority, in every little push you make. With Ringke Slim case, you can push and click every buttons to your phone with no worries. Ultimate slim design and light weight keeps the original design of Apple iPhone 6 4.7 "". [Show off your Apple iPhone 6 logo] The exact precision of the Ringke SLIM Apple Logo Cut Out allows the Apple logo to be shown out from the case. No worries, though! Apple logo is still perfectly protected just as much as other parts of the phone being securely protected by the case. With our 2 logo protective films that are included in the package, your iPhone is safe, all around! [What to Expect in the Package] Ringke SLIM case for Apple iPhone 6 4.7 "" and 2 logo protective stickers']",,,Rearth,Cell Phones & Accessories,"Cases, Holsters & Sleeves",Basic Cases,,0.8384
