,asin,title,description,also_buy,also_view,brand,Category1,Category2,Category3,Category4,avg_rating
111,B00KFSLKXI,"G3 Screen Protector, Tech Armor Anti-Glare/Anti-Fingerprint LG G3 Film Screen Protector [3-Pack]","['. WHY SHOULD YOU BUY TECHARMOR SCREEN PROTECTORS . PRESERVE YOUR INVESTMENT AND MAXIMIZE RESALE VALUE . DID YOU KNOW a screen full of scratches will lower your RESALE VALUE . The Tech Armor Matte Antiglare screen protector not only reduces glare and resists fingerprints, but also protects your screen from scratches that reduce the resale value of your G3. The Tech Armor Antiglare screen protector combines scratch protection with a unique finish dramatically improving visibility in bright sunlight or artificial office light. Use your device wherever you are, whenever you want. For those who often use their phones outside or simply prefer the sleek look of a matte finish on their screen, this is the screen protector for you. We put countless hours into selecting only the highest quality Japanese PET material available on the market. No detail has been overlooked with this Best In Class product from Tech Armor, industry leader in screen protection. If you only accept the BEST for your G3, look no further: BEST AntiGlare technology. BEST AntiFingerprint coating. BEST No Bubble installation. BEST Protection from Scratches. BEST Touchscreen Accuracy. BEST No Hassle Limited Lifetime Replacement Program. COMPATIBILITY: LG G3, All Models. (Note: Turn device display brightness up, Antiglare Screens will darken the image.) The TECH ARMOR AntiGlare Screen Protector Kit Includes: Three (3) Screen Protectors, Installation Instructions, Smoothing Card, Microfiber Cloth, Dust Removal Tape, Retail Packaging, and The Tech Armor Limited Lifetime Replacements.']",B00KOIGZES,,Tech Armor,Cell Phones & Accessories,Accessories,Screen Protectors,,0.826025
112,B00KGOV2O8,White LCD Screen with Digitizer Assembly For LG Optimus G2 LS980 VS980,"[""Note: since LG G2 VS980 lower cable is close to the display cable, so check whether the lower cable and display cable loose.In many cases ,when installing ribbon cable ,the other ribbon cables loose which lead to black screen and touch bad and dead center.  Does not work: because there are two row of LG G2 VS980 touch screen.So there are 3 bad places are easy untouch.So we can divide the assembly into three parts.The first part is close to the receiver part, we call it the upper touch ;The second part is close to the cell phone buttons, we call it a lower touch.The third part is the screen don't touch but can touch up and down in the middle.    2.1: the upper screen untouch or partial untouch: under the condition of standby (mobile phone black screen) to install the upper touch the ribbon cable.Press the power button again (display screen) for testing.If can't touch please use alcohol to clean the ribbon cable . 2.2: the lower part of the screen untouch or partial untouch: under the condition of standby (mobile phone black screen) to touch bottom row line installation.Press the power button again (display screen) for testing.If can't touch please use alcohol to clean the ribbon cable. 2.3: Middle part of the screen untouch: Ribbon cable not fasten up and down is the main reason of the middle untouch.In most cases its the lower touch wiring problem.Reinstall the lower touch cable on the standby environment..It also could reinstall the upper and lower touch cable.""]",,,"Shenzhen BaiYiTong Electronic Co.,LTD",Cell Phones & Accessories,Accessories,Replacement Parts,,0.773225
113,B00KGSW734,"iCarez [Tempered Glass Screen Protector for LG G3 Easy Install with Lifetime Replacement Warranty [1-Pack,0.3mm 2.5D 9H] - Retail Packaging","['1. Tempered Glass Screen Protector Features & Advantages. </br> <br>-- Anti-Blast for Impact Resistance </br> <br>iCarez Tempered Glass can greatly absorb external force from hitting, shocking, dropping etc., it scarify itself to be the best buffer for your screen.</br> <br>-- 9H Super Anti-Scratch Protection </br> <br>Surface hard coating layer can effectively resist wearing, rubbing and scratching to keep your screen brand new.</br> <br>-- Close to 100% Ultimate Clarity </br> <br>ultra transparent body providing good visual effect for everything displaying on your screen. Oleophobic coating reduce fingerprint and smudges to affect the clarity, keep your screen in clean and clear status.</br> <br>-- True Touch Sensitivity </br> <br>Not influence on touch responsiveness and accuracy of your screen after install with iCarez Tempered Glass, enjoy your clicking and playing.</br> 2. Life-time Warranty </br> <br>You are entitled to have the products replaced if the products fail to be of acceptable quality. You are supported with professional and efficient product & after-sales service guaranteed by iCarez. </br> Care mobile, Care you more. </br> <br>iCarez commits to making considerate and premium protection for your mobile device, caring so much about your health and happy life. Experienced by over 10 millions users, our product has won good reputation and recognition. iCarez cares what you care, even more than what you care. It is extending to everyone around the world. Our motivation comes from your satisfaction! </br>']","B00L9OVC94,B00KOIGYS0,B00JW7APWU,B00L9OTQMY,B01I2ISCOW,B00KOIH0OC,B00L9OUF7O,B01EZ2UVGG,B00KOIGZES,B00L9OVUHI,B00NEF9SYW,B0159QHFGG,B072276M5R,B07DHDPK2G,B00RC9O5ZS,B00XOTPRZM,B00MWS5L34,B01JKYRS88,B00QSR2ABQ,B01B5HZJU2,B00JQI2G5O,B074ZQQCB3,B00MG21V2Q,B01MXGUJYN,B00JPL5L2W,B06W9DV7S4,B075JCRR5N,B00K1KTTS8,B071J76VMG,B01DXUH0CO,B01MS2QU13,B078NNQ4Q9,B01DW3F0EW,B01MYFL5X4,B015EOD9KO,B07BYGN7T1,B01M1IE3IU,B01GN0GNWY,B00KRHZHRC,B00KH3HLPC,B00NJ9HVWO,B01DB76R1O,B00LOZQYK0,B0177ZG4FA,B00XVLY434,B00Z7S0E5G,B00KOIGYHG,B00L9OXGMU,B00PBBGFV6,B00MI009M4,B00NWRWP6U,B00MJ4QENW,B01N770EDA,B00JW7AYYE,B01E887MQO,B00TE7IJQM,B01LYL0U1W,B01E887MPA,B01B1GQG3G,B00XJS2O0E,B01DB76LTW,B00T733AOE,B06Y1QV8NM,B01MZAE8FJ,B00L9OWTZA",,iCarez,Cell Phones & Accessories,Accessories,Screen Protectors,,0.80935
114,B00KH3HJY0,DualTek Extreme Shock Case for LG G3 - Matte Black,"[""COMPATIBILITY: LG G3 (AT&T D850, T-Mobile D851, Sprint LS990, Verizon VS985, Unlocked D855) The PureGear DualTek case is made specifically for drop protection. This case is one piece and made of many different materials that are engineered to absorb shock. PROTECTION: The exterior is made of impact resistant polycarbonate that has been treated with a glossy coating. The ribbed grips on the side of the case are ergonomically designed for a secure and comfortable hold. The interior material is a shock absorbing spongy polymer material. The corners of the case feature elevated 3M impact protection - this controls shock by isolating the vibration from drops up to six feet. FUNCTIONALITY: Your phone is fully functional in the case. The lcd screen is recessed within the case for protection (will not touch the surface when placing your phone face down on a table). The case has cutouts for the charger port, speakers, sensors, headset port, camera, volume, power, etc. COLOR/STYLE: The PureGear DualTek case combines rugged protection with style. This case is black color and has gray accents. More colors are available in our store. Bottom line, this is a great investment! If you keep your phone clean and scratch-free this will improve the resale value down the road. Cell phones are expensive...this DualTek case ensures your phone will be safe. This is the ideal case to withstand those accidental drops. Our pictures don't do this case justice - the quality is top notch. Protect your LG G3 phone in style with this rugged DualTek case! COMPATIBILITY: This case was made to fit ALL versions of the LG G3 phone (Verizon, Sprint, AT&T, T-Mobile)""]","B01EZ2UVGG,B01MXGUJYN,B00L9OTQMY,B01DW3EYA8,B078NNQ4Q9,B00NEF9SYW,B00QSR2ABQ,B01I2ISCOW,B01JKYRS88,B00KT1B7AW,B06Y1QV8NM",,PureGear,Cell Phones & Accessories,"Cases, Holsters & Sleeves",Basic Cases,,0.786525
115,B00KH3JYBQ,Case with kickstand + holster for LG G3,['The PureGear protective case features a kickstand for handsfree landscape or portrait viewing. It also attaches to a holster that can be attached to belts or purses for easy access and easily slides in and snaps for a secure hold. The rubberized material offers better grip support to prevent falls and protects all around.<br><br>Features<li>Lightweight durable protection<li>Rubberized material works as added grip support<li>Holster helps protect mobile device screens<li>Low profile stand slides open easily and snaps securely closed<li>Design allows for vertical and horizontal clipping viewing'],,"B00OYAHJ5G,B00KOIGYS0,B00RQNKPVI,B01LW0QVPH,B01N9ODTKO,B01LVVKDUQ,B00WU1V36M,B01E887MQO,B00T1GSLHS",PureGear,Cell Phones & Accessories,"Cases, Holsters & Sleeves",Holsters,,0.77825
116,B00KIUF4DA,ePartSolution-iPhone 5S Black Touch ID Sensor Home Button Module Ribbon with Key Flex Cable Replacement Part,"['shipped from China,7--10 working days to US']","B00JK9HXLQ,B01CG8JAIQ,B00WT1FULW,B00GXWEBNQ,B00WPY4QEA,B00B3O38GK,B01GP91SQ4",,ePartSolution,Cell Phones & Accessories,Accessories,Replacement Parts,,0.80855
117,B00KL58YKM,New Touch Screen Digitizer Glass Panel Replacement for Asus Google Nexus 7+tools,[],,,DigRepair,Cell Phones & Accessories,Accessories,Replacement Parts,,0.773225
118,B00KLCFV88,"Ringke Flex Compatible with Moto E 1st Gen Case Flexible &amp; Strong TPU Case [HD Film][Black] for Motorola Moto E 1st Generation, 2014","['', '<b>More about Ringke FLEX Case</b>', 'Ringke FLEX Case offers flexible TPU gel protection with soft and anti-slip grip. The slim designed case also offers perfect fit for your device. While leaving full access to all functions and ports of the device and providing great protection, Ring FLEX has a tapered lip and lifted camera bezel that raises your phone to a comfortable height off the surface.<br />Ringke FLEX was developed using a new advanced manufacturing process to offer 2-layer style that gives the case an improved grip and prevent sliding on flat surfaces. Ringke FLEX, also provides special geometric heat deduction pattern inside. Because high performance of smartphones can easily overheat with intense usage, our developers built a case with a special geometric heat reduction pattern. The pattern is designed to disperse heat from your phone and reduces over heating to ensure that your device maintains optimal performance at all times.<br /><br /><b>What to expect in the Package</b><br /><br />RINGKE Flex Motorola Moto E Case comes with 1 complimentary screen protective film.']","B00PWEN2ZE,B00KFQ04CI,B00K0NRZ5K,B00M55C0NS,B00V7U9U12,B00VQRCIVA,B01GINUIC2,B01E63IILO,B00S7WVTP8,B00GSIKVRA,B00SIE2YQ8,B0713QLPXG,B00KN92HKY,B0713WH1Y9,B00PHRXSCS,B00NAGI9VI,B00TXGSQ7G,B071FBVP5J,B003OTGYCC,B071KZCH5R,B071JZG796,B00H0MGCDK,B00KFRAIXC,B00QQPNYZ6,B01IFT4DGO,B002ZCW91Y,B079J5THJQ,B00KFRAIX2","B00PWEN2ZE,B00KFRAIXC,B00GSIKVRA,B00O9DUOLE,B00S7WVTP8,B00KFRAISM,B07GC7YWCG,B00KFRAIX2,B0713QLPXG,B00GSIKPGM,B00ENPFBXE,B00GSQ3N0E,B0727V13FG,B00GSIKVPC,B00M55C0NS,B00TXGSQ7G,B00TFAVFJG,B00V7U9U12,B00QQPNYZ6,B01M0786QB,B077Y4LZ6G,B00PHRXSCS,B00O9DQ1N4,B01E63IILO,B073SJ84K7,B00EB3G2JA,B07GC5QKTX,B00H1X8LO6,B00KFQ04CI,B00VQWUF74,B00PG0D3GW,B07GC5FZDM,B00TFAVFL4,B0198FIU72,B071FBVP5J,B0762P8QSG,B07253F5RP,B00JOEXQNG,B07GC4PZLM,B00Z7T52CU,B0115B5390,B074DSDYYB,B074DSCPBR,B07GBS4G8S,B00W1TTADQ,B071KZCTR8,B077Y2HK5Y,B01FDA0HB8,B00VB2QNPC,B073P72ZLN,B07GBX2M3Z",Ringke,Cell Phones & Accessories,"Cases, Holsters & Sleeves",Basic Cases,,0.7070000000000001
119,B00KOIGZES,Otterbox LG G3 Symmetry Series Case - Retail Packaging - Black,"['Otterbox Symmetry Series Phone Case LG G3. Dress your LG G3 to impress with the sleek Symmetry Series. A solid unibody construction fuses a rubber honeycombed core to absorb shock with a hard polycarbonate outer shell, making it is easy to install and even easier to slip into your pocket or purse. Featuring a streamlined design that delivers tough protection from drops and shock, this stylish LG G3 case gives you something no one else can, confidence to look good and feel good knowing your device is protected by the No.1-most trusted case brand in smartphone protection. Stylish and slim case is pocket and purse friendly. Dual-material construction provides trusted OtterBox protection. Easy installation protects and stylizes your Phone in a flash. Materials: Polycarbonate/Silicone Dimension: 6.2""L x 3.3""W x 0.5""H Weight: 0.15 lbs']","B01EZ2UVGG,B00KGSW734,B0159QHFGG,B01JKYRS88,B01MXGUJYN,B00L9OTQMY,B072276M5R,B01DW3F0EW,B01I2ISCOW,B00KOIGYS0,B016KFY8QA,B00L9OVC94","B00KOIGYS0,B00JW7AYYE,B00KOIH0OC,B00KOIGZCU,B01LYL0U1W,B00JW7AWI2,B01EZ2UVGG,B01B5HZJU2,B00KRHZHRC,B00MG21V2Q,B00T1GSLHS,B00RQNKPVI,B00HRO2WKS,B00KGSW734,B00KH3HJY0,B01LW0QVPH,B01M1IE3IU,B00UWZM7GI,B00JW7APWU,B07DWVSM4D,B01JNU753C,B06Y1QV8NM,B01E887MQO,B06XXC8F5D,B071J76VMG,B07HQ5C1TR,B00L8750FY,B00KRHZKJ2,B01LWMN1XD,B00QSR2ABQ,B019PB15GM,B01MXGUJYN,B07DWW7VMY,B0159QHFGG,B01LWMN4RH,B00MJ4QENW,B01I2ISCOW,B073SGFJ61,B01LVVKDUQ,B00Q3M9PBE,B00MNSJGN4,B01NCQG5HF,B07DHDPK2G,B019ILM6WQ,B01DB76LTW",OtterBox,Cell Phones & Accessories,"Cases, Holsters & Sleeves",,,0.8083750000000001
120,B00KOIH0OC,Otterbox LG G3 Defender Series Case with Belt Clip Holster - Retail Packaging - Papaya,"['A powerhouse phone deservers the protection that the powerhouse Defender Series case delivers. If you are looking for G3 cases that withstand our rough lives, look no further. This LG G3 case is made to protect from all of those unexpected drops, bumps and scrapes we get into.The layers work together to absorb and deflect impact force away from your G3.']","B00KGSW734,B00L9OTQMY,B01MXGUJYN,B01EZ2UVGG,B00L9OUF7O,B0159QHFGG,B016KFY8QA,B01I2ISCOW,B00L9OVC94,B01JKYRS88,B00QSR2ABQ,B00X0X2ZCA,B00NEF9SYW,B07DHDPK2G,B00MWS5L34,B01GN0GNWY,B00Z7S353E,B01DXUH0CO,B00L9OVUHI,B01HVT31KI,B01DW3F0EW,B017T6AZH0,B06Y1QV8NM,B01E887MQO,B00L9OWTZA","B00JW7AYYE,B01E887MQO,B01LYL0U1W,B00JW7AWI2,B01LWMN1XD,B00KOIGZES,B00UWZM7GI,B01M1IE3IU,B071J76VMG,B07DWVSM4D,B00KOIGYHG,B01B5HZJU2,B01E887MPA,B00T1GSLHS,B00HRO2WKS,B00L9OTQMY,B00L9OUF7O,B077XB7J98,B00KH3HJY0,B07HQ5C1TR,B01LWMN4RH,B00KRHZKJ2,B06XXC8F5D,B07BGJY2CS,B01LW0QVPH,B01N2KBHT8,B00MI009M4,B00L9OVUHI,B019ILM6WQ,B01JNU753C,B06XFH38J1,B00MJ4QENW,B00K1KTTS8,B00L9OVC94,B07DWW7VMY,B00T76MUAG,B013JTK9MM,B00RQNKPVI,B00MG21V2Q,B00KRHZHRC,B015EOD9KO,B00KGSW734,B01F9XI950,B00X0X2ZCA,B00Z7SD124,B00L9OXGMU,B01MTR25K0,B07G4F7RMV,B00LOZQYK0,B01AHXOT0G",OtterBox,Cell Phones & Accessories,"Cases, Holsters & Sleeves",Holsters,,0.699075
121,B00KR8KNDO,NovaMass White for Samsung Galaxy S5 Touch Screen Glass Digitizer + LCD Display Assembly,[],B015P21AII,"B0122TP0O2,B07G714X1V,B07G5YC4Q8,B01G4VT1QM,B07G7231HM,B0188YRD1I,B07CPCSR2R,B07CZKC8LN,B0188YRE9O,B00K7FK8VO,B07GBY3FTM,B075VQFNFM,B00KCAIHBM,B0122TP0SI,B078S2NT7B,B0722GF7S2,B074T89T2H,B011HYQJNO,B00UABRUOI,B072DTC66F,B06XS98B9F,B078X9FBC6,B0787XGQY3,B07L74FYR3,B078PQNR9V,B075VQLB5P,B078X85HVR,B0787Y7KJ1,B07JZ8VZSY,B078S62YVG,B07KVXT2NY,B07FFVJS8S,B00YVVE6AE,B00KIVBM0S,B01N2R5QC3,B06VW5FVLB,B00YVVE7YO,B01CJU9MJI,B01EXJAW2E,B00K5M4LI0,B075P1S3B6,B07CNL83TN,B07HV1M1YM,B00UYHSUWO,B07GJLPK9H,B01CMFTS2Q,B07C11P888,B00IZ1XVAC,B07GFH46M7,B00IN9HI2I,B076HV5YW2,B00YG6H4XA,B07GFLLL8J,B078S1RXMZ,B00IPGVXFW,B0796B25PV",NovaMass,Cell Phones & Accessories,Accessories,Replacement Parts,,0.806475
122,B00KRHZ6GY,"LG G3 Case, Incipio [Protective] DualPro SHINE Case for LG G3-White/Pink","['Adding a sophisticated twist to a fan-favorite style, the DualPro SHINE Case offers double the protection without the unwanted bulk in a brushed aluminum finish. Two layers consisting of an impact resistant core and a durable outer shell keep your device safe from harm making protecting your device looking better than ever.']",,"B01DB76LTW,B071J76VMG,B01M1IE3IU,B01LYL0U1W,B00JW7AYYE,B07DWVSM4D,B01LWMN1XD,B01MRVL3XB,B01B5HZJU2,B01LWMN4RH,B01DB76ZXE,B01DB7715A,B00KH3SRGE,B07BGJY2CS,B00L87581U,B01DB76R1O,B01DB76S5O,B00K1KTTS8,B00ZC6JADK",Incipio,Cell Phones & Accessories,"Cases, Holsters & Sleeves",Basic Cases,,0.773225
123,B00KRHZHRC,"LG G3 Case, Incipio [Shock Absorbing] DualPro Case for LG G3-Black/Black","['Double your protection with two layers of defense using the DualPro Case for LG G3. The dLAST core absorbs shock while the outer Plextonium shell shields against surface damage. With both layers interlocking together, the DualPro Case offers an ultra-protective solution while remaining slim and lightweight.']","B01EZ2UVGG,B0159QHFGG,B01MXGUJYN,B00KGSW734,B01JKYRS88,B00L9OTQMY,B01I2ISCOW,B00IKEOFCC,B01MUCZILA,B01DJB7M2A,B01BM029AA,B00MAPEMXE,B0794YGLD9,B00KRHZKJ2",,Incipio,Cell Phones & Accessories,"Cases, Holsters & Sleeves",,,0.5288999999999999
124,B00KTGRU4Y,"LG G3 Screen Protector Cover, MPERO Collection 5 Pack of Clear Screen Protectors Covers for LG G3","[""EMPIRE's clear screen protectors for LG G3 phone offers superior protection from scratches, dust, and dirt that may be accumulated from everyday use. It applies quickly and easily using the included applicator and has a self adhesive backing that helps it stay put while not leaving any sticky residue behind should you decide to remove or replace it. The precision-cut of the screen protector LG G3 allows for a perfect fit with any case you may have protecting it. Also included with the screen protector is a cleaning cloth which is to be used to wipe away smudges or fingerprints accumulated from everyday use.""]","B00WIRSWMG,B01E887MPA",,EMPIRE,Cell Phones & Accessories,Accessories,Screen Protectors,,0.7854
125,B00KW09II8,Samsung Galaxy S4 LCD + Digitizer +Frame- i545 L720 R970,[],,,NovaMass,Cell Phones & Accessories,Accessories,Replacement Parts,,0.806475
126,B00L2PDY6O,"LG G3 Screen Protector, Skinomi Tech Glass Screen Protector for LG G3 Clear HD and 9H Hardness Ballistic Tempered Glass Shield",[],"B06X6GKSB8,B00XWQTXG6",,Skinomi,Cell Phones & Accessories,Accessories,Screen Protectors,,0.72645
127,B00L8750FY,Trident Aegis Series Case for LG G3 - Retail Packaging - Black,"['Designed with a modern protective exterior, the Aegis Series case from Trident Case is a perfect blend of style and durability for everyday use. Aegis Series cases feature an inner-layer of shock-absorbing silicone with an outer-layer of hardened polycarbonate, providing two layers of protection.;;The hardened polycarbonate exterior allows it to slide in and out of pockets with ease. This case Series protects device power-ports and audio-jacks with silicone plugs to keep out dirt and debris. These cases also include dust filters to protect speaker bays, and a self-applicable screen protector for reliable screen protection.;;Aegis Series cases meet Military Standard MIL-STD-810F for vibration and drop (independently tested). They are slim and lightweight, but packed with protection. Fits LG G3. Black.']",,"B00JW7AYYE,B01LYL0U1W,B013H44JVG,B00MJ4QENW,B00KH3HJY0,B01EZ2UVGG,B00K8855AE,B00KOIGZES,B06XXC8F5D,B01B5IURDU,B01B5HZJU2,B01M1IE3IU,B00KRHZKJ2,B00LNR3ZFQ",Trident Case,Cell Phones & Accessories,"Cases, Holsters & Sleeves",Basic Cases,,0.77825
128,B00L9ICFG4,"iPhone 6 Case, Caseology [Daybreak Series] Slim Fit Shock Absorbent Cover [Black] [Slip Resistant] for Apple iPhone 6 (2014) &amp; iPhone 6S (2015) - Black",['Suitable for the iPhone 6 case'],,"B0752X3PGW,B074CMWM9H,B074CM94D9,B074CMY8C1,B00L9ICGOU,B00L9ICE9M",Caseology,Cell Phones & Accessories,"Cases, Holsters & Sleeves",,,0.675775
129,B00LG0QQSI,Generic ePartSolution-Samsung Galaxy S5 G900A G900T G900V G900P Camera Lens Cover Repair Part,['Delivery Package:1 x Samsung Galaxy S5 G900A G900T G900V G900P Camera Lens Cover Replacement part<br><br>Compatible Samsung Galaxy S5 G900A G900T G900V G900P Camera Lens Cover'],"B00L4RYCMU,B00KFKS9H6,B06XHR891Y,B00YG6H4XA,B00G7UY3EG,B01LX3XHWQ,B00R3IHYI8,B00N1VPV9K",,Generic,Cell Phones & Accessories,Accessories,Replacement Parts,,0.806475
130,B00LG6RZRS,ZAGG InvisibleShield Glass Screen Protector for LG G3,"[""Invisible Shield Glass is the next evolution in premium screen protection. Made of high-quality tempered glass, it delivers maximum scratch protection while preserving crystal clear image resolution. It's so good and so strong that every Glass is guaranteed for the life of the device it protects. In addition to unmatched protection, Glass maintains precise touchscreen sensitivity. It's only 0.4mm thin and features a unique oil-resistant coating that repels natural skin oils so it's always a breeze to clean. And speaking of easy, installing GLASS is a simple as aligning it, pressing it, and watching it magically do the rest. All in all, Glass is the clear choice in screen protection.""]",,,ZAGG,Cell Phones & Accessories,Accessories,Screen Protectors,,0.7781750000000001
131,B00LGWTM5U,"[2-PACK] Galaxy S8 Plus Screen Protector Glass [Easy Installation Tray], iAnder 3D Curved [Tempered Glass] Screen Protector for Galaxy S8 Plus S8+ [Case Friendly]","[""<b>Galaxy S8 Plus Screen Protector Glass [Easy Installation Tray], iAnder 3D Curved [Tempered Glass] Screen Protector for Galaxy S8 Plus S8+ [Case Friendly]</b></br></br> <b>IMPORTANT NOTE: This model only for Galaxy S8 Plus S8+ , will not work for Galaxy S8</br></b></br><b>Real Tempered Glass</b> </br> Made of real tempered glass that protects the original screen from shattering, with an industry leading hardness of 9H, just below diamond with a hardness of 10H.</br></br> <b>Waterproof and oil-proof </b></br> 96% High-definition clear hydrophobic and oleophobic coating can prevent the water and from scattering. Water and oil can be wiped away very easily.</br></br> <b>Silicone Bubble-free Adhesive </b></br> Adheres to the phone's screen without any gaps or bubbles, leaving the touch sensitivity unaffected.</br></br> <b>Ultra-clear Screen</b></br> 96% High-definition clear hydrophobic and oleophobic screen case coating protects against sweat and oil residue from fingerprints.</br></br> <b>Easy installation </b></br> The glass screen protector can be easily installed without bubble and and removed without residue.</br></br> <b>Installation Instruction:</b></br>Step 1: Clean the screen with wet cleaning pad,dry it with wiping cloth.</br>Step 2: Use dust removal sticker to stick out the dust.</br>Step 3: Place the installation tray over your mobile phone.</br>Step 4: Place the screen protector in the tray and gudies to line up with the screen correctly.</br>Step 5: Take off the installation tray.</br>Step 6: Press down the side of the screen protector firmly to stick it to your phone.</br>""]","B0764H6VQS,B00JNPFVAC,B07M9L2F64,B07JN53PNV,B0713TFRWP,B06XNSZJ31,B06XD115HW,B06XP7S564,B072QZ2CV8,B06XP6CRP5,B076HV5YW2,B06Y6NJ3J1,B06Y16RL4W,B06XHLXNCL,B073GT454S,B074J4ZGM9,B072BX6R1L,B0788ZD69Z,B07GTBC3WW,B07J28CFHN,B07MMX19YV,B074QDSW2B,B07GCLSF82,B07CTWCXR4,B0742MQZCY,B07GC4KX2Q,B06WWG3JGV,B076FPGWNZ,B073HVXQY9,B07BH2BFLD,B07BC356C7,B07BLVTHJL,B01LXZDPDR,B06XP1VYZF,B06XP4FP8N,B06XP1VWND,B06XXP8QDZ,B06Y3ZWDWY,B07GZ4VLBX,B07KM4FWJ4,B06XCT3F8J,B06Y6NFQPN,B07GZ2Q5PP,B06XDXH3J6,B0776RDKHS,B06XGWRLTD,B06XCSN5RJ,B06XNVNX48,B06XP1VQTM,B00Z7TR4VC,B06XJBY2SW,B06XRQDYP2,B06XJHZJZD,B07GCR3Q6G,B076ZG61R6,B079YC1TRH,B074SJV133,B076P43DH9,B074G1W2RC,B07KF84XPN,B07GGNZ97D,B0789T9WQN,B07J4PJB4X,B06XD3W3WK,B06Y1HY64V,B06XNNJ4KM,B07FXLSTJQ",,iAnder,Cell Phones & Accessories,Accessories,Screen Protectors,,0.70545
132,B00LHFNTRS,LCD Touch Screen Digitizer Glass Assembly for Iphone 5s White,"['<br>color:white <br>Ps: This item is without home button , camera and ear piece . <br> <br> <br>Package contents: 1 x White LCD Touch Screen Digitizer Assembly for iPhone 5S <br>1*repair kit']",,"B00JKAKZJW,B07GL2F61B",WEELPOWER,Cell Phones & Accessories,Accessories,Replacement Parts,,0.8116749999999999
133,B00LIJGXU8,"Kyocera Hydro Icon Case, CASEFORMERS Duo Armor HOT PINK for Kyocera Hydro Icon Combo Case with Stand and Holster","['The CASEFORMERS Duo Armor Case and Holster offers your Kyocera Hydro Icon the best in protection while throwing extra features like a adjustable belt clip and an independent kickstand. Our CASEFORMERS Duo Armor Case protects your Kyocera Hydro Icon with shock absorbing layer to deal with those nasty drops, while a hard exoskeleton layer adds a stiffness that protects all the internal parts. This case feels great in your hands as your fingers wrap around all the grooves and the soft silicon for a tight grip. The precise cutouts provide full access to all your Kyocera Hydro Icon buttons, jacks, and features. This Duo Armor Case also features two viewing stands for hands free viewing.']",,,CASEFORMERS,Cell Phones & Accessories,"Cases, Holsters & Sleeves",,,0.806475
