,asin,title,description,also_buy,also_view,brand,Category1,Category2,Category3,Category4,avg_rating
252,B00YBYN6FC,"EShine Replacement Proximity Sensor Light Motion Flex Cable with Front Face Camera for iPhone 6 4.7 Models A1549 (GSM), A1549 (CDMA), A1586, A1589 + EShine Cloth",['iPhone 6 Front Camera &amp; Sensor Flex Cable Replacement will fix the 1.2 megapixels camera that faces you as you look at the screen of your phone. It also will fix the proximity sensor that is attached to the camera and detect distance and focus correctly. This OEM compliant part will also fix a faulty camera or cracked lens. Replacing the proximity sensor will allow your iPhone 6 to calculate the distance to the object in focus so the camera can focus correctly. It also calculates the amount of light the camera needs to compensate for in exposure settings.No instruction Provided with our replacement.Comes with microfiber EShine cloth and in antistatic bag for safe transportation.'],"B01N6RBWOI,B00XJ56AC0,B00ZUYVM44,B0160MDINW,B00XJGQ2UE,B00WPZQNTA,B01ETCBZXA,B00XSY48Z8,B01EL4ANUW,B00XNA80Z6,B00XJ5984M,B0796XWGLY,B0160MOVME,B00XT03HK8,B01N7O4HZF,B01EFG8AHE,B06XVTHDNL,B01N48A0Z6,B018Q9IUBW,B06XD6G2GB,B01ETCM6VA,B01EL1SSLG,B018VNHSS4,B07DGVBVKW,B00XT08OTW,B079FYKKNX,B077N347VD,B0773JV8ZH,B01DLRBI5O,B07CXQX8DR,B01DLQZ31U,B07FG81BMK,B01LZ4VO34,B0741GB18B,B01L8U11FI,B01EL96W1G,B0796BKG4X,B01G3R4ZNQ,B06Y5J2J6W,B074P552JS,B01KZHAH28,B01EL7W3VG,B07CSS8N8Q,B01CG8JAIQ,B07HHS7FFS,B07D67FHNX,B07B718WNY,B00PJS4108,B00XN9Z6QI,B01CMFTOTS,B01EFG8AHO,B01CMFTS2Q,B07BS7DWG2,B0796BFFQY,B01CMFTQRI,B06XD8NK43,B01HPXAB4O,B01CMFTPQA,B01G3R4ZRM,B07H8VDFXJ,B06XWBLYC1,B073QMH1Y8,B07FN97GWW,B06XCRZP2C,B071SD3MGR,B01KZE99Q6,B07FJWLRXQ,B07G5JRR9G,B0796CFYL6,B01L8U12PW,B01DLIOZNU,B06XDBVD9Q,B07DGV9VYB,B078Q7VDN6,B075RZ89RQ,B07DRBZX9M,B01DA2KEZU,B07BT1L7XL,B01JYZA6FA,B06VW165RT,B077ZN7HZZ,B07K1VX27Q","B01EL4ANUW,B0160MOVME,B01EL7W3VG,B0796BKG4X,B00QZNU4EI,B0160MDINW,B01CMFTS2Q,B01CMFTOTS,B01N6RBWOI,B00XJGQ2UE,B00XN9Z6QI,B00XJ56AC0,B01EL1SSLG,B00XNA80Z6,B06W2PGT4F,B00YBYTBU6,B01EFG8AHO,B06XVWVQZF,B077ZN7HZZ,B07BS7DWG2,B01N9Z3CKZ,B0796XWGLY,B01JYZA6FA,B00XJ5984M,B01CMFTQRI,B06WP6Y8R2,B01M5CWA6F,B01GRVO830,B01GRU5O3E,B01G3R4ZRM,B07DM3LN1G,B06XVTHDNL,B0796BFFQY,B01ELCQAPQ,B01DQ7E8OM,B07BWD5N8Z,B00NTZO0IQ,B01ETCBZXA,B01EL32VRG,B07DBKH3GL,B071SD3MGR,B0796CFYL6,B07FS5S6J1,B01H4XY1AU,B07G5JRR9G,B07FS1SYJZ,B0711Y7V1V,B07HKYGLZY,B07G6Z2RTP,B07CSS8N8Q,B01A8FQKDM,B07D67FHNX,B01MT8DOW8,B07FCJ3X4Q,B074P552JS",EShine,Cell Phones & Accessories,Accessories,Replacement Parts,,0.8208
253,B00YGHLLOC,EShine Back Rear Camera Glass Lens Cover Ring Replacement + Adhesive for Samsung Galaxy S6 G920 (ALL CARRIERS) + Cloth (White),[],"B01M7NXE79,B00WFAXVTK,B00WDYQQM2,B00YGHLLOW,B01MDLPPQS,B01203TZKU,B01M6WH6NG,B01M3PL8ED,B01M63O7DZ,B01M2WVBWD,B01M7RZGIV,B01M22WXX2,B072K7T29V,B074RX3FW7,B01M59OAYS",,EShine,Cell Phones & Accessories,Accessories,Replacement Parts,,0.8208
254,B00YIRRIJ2,LG Leon / LG Power / LG Destiny Case - Hybrid Wave Symbiosis Case Shockproof Tough Armor Cover Protector with Kickstand (Armatus Gear Stylus) For LG Leon LTE C40 / H320 (T-Mobile / AT&amp;T / Metro PCS) / LG Power L22C (TracFone / NET10) / LG Destiny L21G (StraightTalk) - Red/Black,['LG Leon / LG Power / LG Destiny Case - Hybrid Wave Symbiosis Case Shockproof Tough Armor Cover Protector with Kickstand For LG Leon LTE C40 / H320 (T-Mobile / AT&T / Metro PCS) / LG Power L22C (TracFone / NET10) / LG Destiny L21G (StraightTalk)'],,,Armatus Gear,Cell Phones & Accessories,"Cases, Holsters & Sleeves",Basic Cases,,0.806475
255,B00YL0MXRI,Wearlizer Genuine Leather Pink Compatible Apple Watch Band 38mm Womens iWatch Classic Sport Strap Leisure Wristband Replacement Casual Beauty Bracelet (Metal Clasp Buckle) Series 3 2 1 Nike+ Edtion,['Material Watch Band: Genuine Leather Buckle: Stainless Steel Size Watch Band: 17.5cm*1.8cm*0.2cm Buckle: 2cm*1.5cm Package Includes: 1 * Watch Band for Apple Watch 1 * Anti-scratch Protective Skin'],"B01DD9Z1JE,B00UH3K244,B01AIH2BM4,B014HA8RG2,B013XFHV5K,B01L8MUHIS,B01F3IBKNO",,Wearlizer,Cell Phones & Accessories,Accessories,Smartwatch Accessories,Smartwatch Bands,0.67825
256,B00YMZNDUS,cellphoneage&reg; White Replacement Digitizer and Touch Screen LCD Assembly with Tools &amp; Free Gift For iPhone 6 Plus 5.5&quot;,[],,,l,Cell Phones & Accessories,Accessories,,,0.786525
257,B00YN7J99Y,For iPhone 6 plus 5.5'' Replacement,[],,,l,Cell Phones & Accessories,Accessories,Replacement Parts,,0.8208
258,B00YQ1VCL0,LG G4 intelliGLASS HD - The Smarter Glass Screen Protector by intelliARMOR to Guard Against Scratches and Drops. HD Clear with Max Touchscreen Accuracy.,"['<b>Who hasnt dropped their device once or twice? intelliGLASS LG G4 screen protectors from intelliARMOR keep those drops from becoming headaches. intelliGLASS has been specially crafted with a harder than steel tempered glass inner layer and an Oleophobic outer layer. These work together to prevent scratches, absorb shocks, and repel oil &amp; grease. Best of all, because its real glass, you retain 99.99% touchscreen accuracy and clarity. <br> <br> Why Is intelliGLASS The Smarter LG G4 Screen Protector? <br> <br> intelliGLASS is the best LG G4 screen protector because it offers an ultra high clarity outer shield that will shield your screen from scratches and drops. Did you know that LG G4 screen replacement can cost hundreds of dollars? As your LG G4s outer ARMOR, intelliGLASS will absorb just about any impact, sacrificing itself for your phone. </b> \n<br> \n<br> * Ultra clear and responsive \n<br> * Satisfaction Guaranteed \n<br> * Premium protection from drops and scratches \n<br> * Maximize resale value \n<br> * Bubble free installation \n<br> \n<br> \n<b>Each intelliGLASS kit includes</b> \n<br> \n<br> 0.33 MM intelliGLASS screen protector \n<br> Touch screen cleaner \n<br> Dust removal tape \n<br> Microfiber Cloth \n<br> Retail Packaging \n<br>']",,,intelliARMOR,Cell Phones & Accessories,Accessories,Screen Protectors,,0.773225
259,B00YQFJ920,"XLon Screen Protector, 0.26mm 9H Tempered Shatterproof Glass Screen Protector Anti-Shatter Film for Samsung S9 [3D Touch Compatible &amp; 2-Pack]","[""p/>Product description High Quality Glass Screen Protector 0.26mm Tempered glass protectors is made from chemical processed glass, which has excellent display clarity, high sensitivity and smooth touch. Anti-oil coating, avoid smudges and reduce fingerprints. 9H Surface hardness rating to prevent your phone to scratch and scrape. Advanced Silicone Adhesion You just need to put the sreen protector gently on the cell Phone, it can be perfect installed. Tight adsorption between the protector and cell Phone won't produce any bubbles after installation. What's in the package Samsung S9 Tempered Glass Screen Protector x3 Cleaning wipe x2 Dust-removal sticker x1 Wet wipes x2 Installation manual x1 Friendly Reminder: Please be careful to avoid scratching on your fingers, as it is made of fiber glass and has sharp edges like glass when it is broken.""]","B015EOD9KO,B01BW6QEMI","B01BW6QEMI,B00XJS2O0E,B01DW2XMYS,B01KA0BSZ0",XLon,Cell Phones & Accessories,Accessories,Screen Protectors,,0.80975
260,B00YU08SOG,4pmla HDMI Adapter Converter Digital AV Adapter for Select on HDTV Monitor Projector,"['<br>Features</b><br> 1.Anything but basic, the Fancathy Bamboo t-shirt is made from the same luxuriously soft organic bamboo fabric as your favourite Fancathy undershirt<br> 2.Without Sweat Secret Technology in the underarm. Becoming the perfect women organic tee for your wardrobe essentials that\'s great for casual wear<br> 3.The comfort of Fancathy undershirt depends on three main factors---Thermal comfort,touch comfort and stress comfort.Bamboo fiber with strong hygroscopicity,good air permeability,is much better than the traditional fiber fabric.So it meets the characteristics of thermal comfort.<br> <br> Recommend the use of transparent soap or laundry soap, laundry paste washing, hanging in a ventilated place to dry naturally, not long time exposure under sunlight ,which could avoid fading. Most of the new cotton padded clothes will have floating color, it is recommended to put a small amount of vinegar in the water to wash before wear it.<br> <br> <br>SIZE CHART</b><br> Size:S M L XL<br> Size:S----Length:68cm/26.8"";bust:90cm/35.4"";<br> Size:M---- Length:69cm/27.2"";bust:94cm/37""<br> Size:L ----Length:70cm/27.6"";bust:98cm/38.6""<br> Size:xL----Length:71cm/28"";bust:102cm/40.2""<br>']","B01EMWJ6Z6,B017AKLO4S,B01KA0BSZ0,B01DW2XLGM,B01N95SOFQ,B00Y2P8QHI,B01N9P1713,B07D2CWBS1,B00C40OG22,B00YBYNQZM,B013XQZ39U,B00XVLY434,B00ZHW0Y5W,B01G8LN88U,B015S551MI,B06Y34QWB2,B06ZYLQ2TP,B01FYBG5LW,B00WLAYCYC,B00XJS2O0E,B01BW6QEMI,B00WSZ3B74","B00Y2P8QHI,B014228XW8",4pmla,Cell Phones & Accessories,Accessories,Chargers & Power Adapters,,0.72995
261,B00Z7S0OTW,OtterBox 77-53330 COMMUTER SERIES Case for LG G5  - BUBBLEGUM WAY (BUBBLEGUM PINK/SEASHELL PINK),"['You dont have time to precision pack your briefcase. So, pack along the sleep, slim Commuter Series case - easily fits any crevice in your bag. Featuring a tough two-layer construction, Commuter Series helps keep your phone safe from drops, bumps and life on the go. Plus port plugs stop dust from entering jacks and inputs, so your phone stays clean.']","B01MYFL5X4,B01MXVE6N1,B01MDUEUWD,B06XS1TG2D,B06X9L5W9B,B071KR8H16,B0748B971D,B01F4QKE50,B07BYGN7T1,B00Z7S353E,B07K7HV5JH,B01K8EFRFU,B00Z7S3YEY,B079NPN7JB,B07D6J929K,B01GF39RD6,B01DM8PTGG,B01DM8PTG6,B00Z7S3FKC,B01DNN907O,B01MG7OH8U,B06X41VPZC,B079RJVWNC,B07FVQ4N9K,B01BZELGWU,B01EI3LWMO,B01DUELVYG,B072Q1JTVH,B07BNY1N4T,B074DQQGFS,B07B9WQTFN,B01B1GQDGG,B0789K9ZJ1,B079QLJ3F9,B01MA4YEAR,B07CYKMGQL,B075CH3C2H,B076CD3RP7,B00Z7S6IY2,B01DX876HK,B01DM2VT0M,B01N7KMB2H,B07FXGDP6W,B00Z7S29UE,B01H0OF6XE,B071486GB9,B01D22Y3BO,B07DCKNGZZ,B01N6JT1FP,B00VS3X78K,B01MS2QU13,B01DM2VP8S,B01KGI43P8,B01DM2VRGS,B01FL9WFW0,B01B3J7L6M,B07BRKMZ4R,B01K9G91KY,B078K1JT26,B074SK423P,B01BZMNZ2G,B0772V6696,B01C5X0CKM,B00X0X37P4,B01EHS6CB6,B06ZZHQKDN,B07C1G9TZP,B01MS6J0B8,B01M210GA8,B01B3J7H5W,B01GNN7SSY,B01BIIDSCE,B071FV126P,B075NGNRLV,B01BEH1RY0,B01DJB7M2A,B07BNWZVNM,B07CXMNDNR,B077CY5YRH,B06XD3PHJY,B01MQDGSXW,B00Z7SCINM,B07BKY2MQF,B072NJCZWT,B01D5ZVO9C,B01C26RR3M,B00Z7RQB7M,B01C5X0BL2,B00X0X2ZOI",,OtterBox,Cell Phones & Accessories,"Cases, Holsters & Sleeves",Basic Cases,,0.459875
262,B00Z7S3YEY,OtterBox SYMMETRY SERIES Case for LG G5  -BLACK,"['Symmetry Series is the culmination of over a year of design, testing and innovation. This sleek, cleanly constructed protective smartphone case is simple to install in its one-piece form. But dont let its elegant simplicity fool you - the dual-material construction makes Symmetry Series one of the slimmest, most protective cases in its class. The raised beveled edge helps keep the touch screen safe, while the internal material and honeycomb coring help protect the device from drops and shock. A full spectrum of wraparound colors and graphics on the sleek polycarbonate exterior add seamless style to complete your entire look. The slender, simple Symmetry Series has the style you want with the protection you need.']","B01MYFL5X4,B01MXVE6N1,B07BYGN7T1,B06XS1TG2D,B01MA4YEAR,B01MDUEUWD,B01K8EFRFU,B079RJVWNC,B071KR8H16,B074SK423P,B0748B971D,B079NPN7JB,B06X9L5W9B,B01B1GQDGG,B01KGI43P8,B01F4QKE50,B00Z7S6IY2,B07D6J929K,B00Z7S21HK,B01BZELGWU,B01DM8PTGG,B078K1JT26,B00Z7S353E,B01BZMNZ2G,B00VS3X78K,B00Z7S0OTW,B07DCKNGZZ,B07FVQ4N9K,B01DM2VRGS,B01N6JT1FP,B01N0V29Q0,B07B9WQTFN,B07K7HV5JH,B073F7XXRK,B01FL9WFW0,B01H0OF6XE,B01MS2QU13,B074DQQGFS,B07F8T4S42,B01DX876HK,B01B1GQG3G,B01N1WJCHS,B077CY5YRH,B01DM8PTG6,B01GF39RD6,B01N7KMB2H,B07J2F61JD,B079K13FQZ,B00Z7SD3V8,B071ZHXLWH,B00X0X37P4,B01GNN7SSY,B01MG7OH8U,B07BRKMZ4R,B076CRVVNX,B01C5X0CKM,B075NHJP44,B01BTPCESK,B01B3J7F54,B07C1G9TZP,B01C1YGO84,B07CQL6M55,B01BZMO46M,B075NGNRLV,B07FXGDP6W,B01D22Y3BO,B078LTMGTT,B01I5L21MK,B00Z7SCBFC,B01B3J7L6M,B074G1WQD5,B01MZ285ZT,B07489XLQ4,B01MS6J0B8,B00Z7S2JEU,B01D5ZVO9C,B01N2WCIN0,B00Z7S0E5G,B01MQDGSXW,B072NJCZWT,B01C5X0BL2,B01MTNAZQ1,B073NH2M94,B01CZW8C9G,B072XG2FY1,B01N0T9YO6,B07BKY2MQF",,OtterBox,Cell Phones & Accessories,"Cases, Holsters & Sleeves",Basic Cases,,0.82525
263,B00Z7S353E,OtterBox DEFENDER SERIES Case for LG G5 - Retail Packaging - BLACK,"['Drops, dirt, disasters  Defender Series for LG G5 is tough enough to withstand the worst. In fact, its the toughest Defender Series yet. Featuring a death-defying design with a built-in screen protector, plush foam buffer, rigid inner shell and resilient outer slipcover, Defender Series walks away from falls unscathed. To top it off, Defender Series comes with a heavy-duty holster thats a belt clip and kickstand.']","B079RJVWNC,B01MYFL5X4,B07BYGN7T1,B07B9WQTFN,B01MDUEUWD,B01MZ8TV4B,B01F4QKE50,B01MA4YEAR,B01N7KMB2H,B01DM8PTGG,B07K7HV5JH,B07D6J929K,B075NGNRLV,B079NPN7JB,B00Z7S0OTW,B07DCKNGZZ,B06X9L5W9B,B00VS3X78K,B01BZMNZ2G,B074DQQGFS,B01DX876HK,B078WCJ5M4,B01D22Y3BO,B0789K9ZJ1,B01B1GQL6I,B01BRFS6S4,B01MG7OH8U,B01DM2VRGS,B01DM8PTG6,B01EFQMFSY,B01NBYNM5A,B07HNR6DXN,B01DWOT0QA,B00Z7S21HK,B07D4G3DDQ,B07CQL6M55,B01B3J7F54,B01B1GQDGG,B071KR8H16,B07FXGDP6W,B01GF39RD6,B07C1G9TZP,B01N7K0T9P,B01B1GQG3G,B00Z7SACOE,B073V2LY6B,B01N5KL10L,B079JL2FSY,B06XWZWYVP,B00Z7S0E5G,B07K7H1T61,B07BKY2MQF,B00Z7RQB7M,B00Z7SWI0A,B00Z7SF7GM",,OtterBox,Cell Phones & Accessories,"Cases, Holsters & Sleeves",Basic Cases,,0.792875
264,B00Z7SAGZ4,OtterBox Defender Series Case for LG G6 - Frustration Free Packaging - Marathoner (Cowabunga Blue/Gunmetal Grey),"['Defend your device against drops, dirt and scrapes with Defender Series. Combining an internal shell, outer slipcover and touchscreen scratch protector, Defender Series for LG G6 TM deflects the action and accidents that come your way every day. Plus, the included holster doubles as a kickstand. Defender Series  because life happens!']","B01MS2QU13,B07D2JL7TS,B07171R1FM,B00Z7SCBFC,B01N7NKS40,B00Z7SI8BS,B06W2GGNNH,B00Z7SCINM,B06XJFDTN7","B07FK66GLZ,B07HZWXV2K,B00Z7SD3V8,B00Z7SCINM,B00Z7SCBFC,B06XCBXXYF,B01MYAJT88,B00Z7SI8BS,B06XCY1JQM,B00Z7ST7PO,B01N7UJ4H8,B01MR8C4RY,B06XCVCXZ5,B01MUCZILA,B00Z7SI3KO,B06W2GGNNH,B06XCVNZTV,B06XCBJHS4,B06W52JJLH,B06XN6RYWC,B01MR8C5Z7,B06XT6RDHN,B01N4QCEHA,B06XC11PK8,B01N6NKXLW,B06XT9JL2L,B06XCGVXDN,B01MQY6BJK,B06XSR6WXC,B06XGZ1LRM,B06XD6MXCB,B01MS2QU13,B06WRQR17T,B06XJFDTN7,B01MUARHEP,B07DWMX5P2,B06XT36DCQ,B06XGY6MTX,B06WCZY9CK,B06XC8W9Z1,B06XSR6T2V,B01N6QD1QW,B06WLK9X84,B07DWHRM71,B07KYHTBLS,B071K7BSK3,B00Z7S353E,B06XTCM7C5,B06XXP7Q25,B07GCXGNKS",OtterBox,Cell Phones & Accessories,"Cases, Holsters & Sleeves",Basic Cases,,0.773225
265,B00Z7SD3V8,OtterBox 77-55435  SYMMETRY SERIES Case for LG G6  - CLEAR,"['With Symmetry Series Clear for LG G6 TM, thin equals tough. Featuring an ultra-slim profile and OtterBox Certified Drop+Protection, Symmetry Series Clear stays true to your phones sleek design  and we stay true to our promise of protection. Plus, the clear, scratch-resistant exterior highlights your impeccable taste in technology.']","B01MS2QU13,B00Z7SIDCW,B07D2JL7TS,B071DJ6WBK,B07B482XXM,B00Z7SACOE,B06XWQLD7D,B01N7NKS40,B06WLKSMS3,B07451RCZN,B07DQKMXL6,B01N336WNY,B06W9DQD5R,B06W9DV7S4,B07794VK9P,B07HZWXV2K,B06XZFHTBC,B06XPQQG5W,B07BRKN5V2,B074HQT41F,B00Z7SAQ5E,B074Z73BH3,B07BYTCJVL,B00Z7SAGZ4,B077Q7J9LL,B075GX8N27,B072QCMZLC,B00Z7SD7SM,B07171R1FM,B071JG9XVY,B01N7UJ4H8,B01MYAJT88,B01MQY6BJK,B06XYRS7CT,B06X3QGSTZ,B078K7M3XC,B01NBWSX8S,B07GGV7YQQ,B071KSJ7PY,B07887MTJW,B01N6M8AOV,B01MR8C4RY,B01MUCZILA,B06ZZ5ZG53,B01N6T9PHS,B00Z7S3YEY,B06XSR6T2V,B06WCZY9CK,B06XFSJLLQ,B06XDNYDJJ,B06Y3NWMR6,B06XCBJHS4,B072BML9FP,B00Z7SH1TI,B06XN6RYWC,B076KRG3GX,B06WRRX3J9,B071FCDL9C,B01NH2XF8X,B06WRRHNJL,B01B3J7F54,B06XHQHTQ4,B01N5M5TI5,B06Y3KXHXF,B076H16TWP,B06Y46S762,B01N6NKXLW,B06WGQ6FHR,B06XGV1QVF,B06W5K3YWF,B077JGGL16,B073WV3KCD,B00X0X37P4,B06XD3PHJY,B06XGY6MTX,B06XJFDTN7,B07FK66GLZ,B01N6QD1QW,B01N4QCEHA,B00Z7SAM8U,B06XZFG5P1,B06XYQGPKT,B06VWGD7MJ,B073BLDXW4,B06XCY1JQM,B06W2GGNNH,B07DC5PPFV,B06W52JJLH,B06XCBXXYF","B00Z7SACOE,B00Z7SAQ5E,B07FK66GLZ,B00Z7SAGZ4,B00Z7SHFZ8,B00Z7SAM8U,B07HZWXV2K,B00Z7SH1TI,B06VWGD7MJ,B00Z7SH6G6,B01NBWSX8S,B01MUCZILA,B00Z7SHB9I,B01MYAJT88,B01N6QD1QW,B06XT6RDHN,B06W2GGNNH,B06XZFG5P1,B01N4QCEHA,B01N7UJ4H8,B06WRRX3J9,B01MR8C4RY,B01MR8C5Z7,B06XZWGXY3,B06W52JJLH,B06XZS5138,B06XCBJHS4,B06W5K3YWF,B072817Q5X,B01MS2QU13,B072BML9FP,B07HYWPMNG,B01N6T3N9T,B06XCGVXDN,B06WGQ6FHR,B06XSR6WXC,B06XT9JL2L,B00Z7SD7SM,B06XC11PK8,B06XGY6MTX,B06XCVCXZ5,B06XCY1JQM,B06XZFHTBC,B06XN6RYWC,B06XSR6T2V,B06XCBXXYF,B06XDNYDJJ,B01NH2XF8X,B01N6NKXLW,B06XZSS3GX,B077Q7J9LL",OtterBox,Cell Phones & Accessories,"Cases, Holsters & Sleeves",Basic Cases,,0.697675
266,B00Z7T5L12,OtterBox Defender Cell Phone Case for LG V10 - Retail Packaging - Black,"[""The OtterBox Defender Series case for LG V10 provides heavy duty protection against drops, dust and damage without taking away from the usability of your phone's features. The Defender Series case offers triple-layer protection and is built from a high-impact polycarbonate shell, durable silicone slipcover and a built-in screen protector, making it one of the toughest cases on the market. Why else do you think we called it the Defender Series?""]","B017JOQ7CO,B01AASN2U6,B07728S5HP,B01DZFB5IC,B01IUFAUQ0,B01LYJQWAM,B071CZV1B7,B01IFYQFHO,B01K7FQGK0,B0756YNQDH,B06XRGYNL2,B07K6HQKN3,B06XKJWLG4,B01FDMXDWQ,B07J4VDJ2L,B01B6OTDCE,B018PEE94K,B079DRS9XD,B07H1G7XHC,B016WSNTC4,B0161ZDWIO,B01NBIOXOF,B07C5M84GS,B01L7I0GS4,B07HHRXQ5B,B01KPFIATM,B01AOC3PGY,B01N6LE2SB,B07HHRXQ58,B01MR364YB,B07CHZ8S29,B015EOD9KO,B00X0X32RW,B01FDMXESY,B06X9M84GV,B017UXBUHQ,B01DXY9G3G,B07DQHJMPD,B01KNIOEVY,B01E8OXDH0,B0753MN5YB,B016J43XOK,B01BKFN7LW,B079JR21JL,B00Z7T66NE,B01MS2QU13,B019ELY8KS,B07F2SK2XD,B01DZFAZPQ,B01AR9OOGE,B0176UXH7E,B07JDMZ6M1,B019LNOR64,B00Z7RQB7M,B01MSMT7Y8,B00XJS2O0E,B01N9CTQ01,B0753Q8WQH,B01BKFN2D0,B00W898IZ0",,OtterBox,Cell Phones & Accessories,"Cases, Holsters & Sleeves",Basic Cases,,0.690825
267,B00ZHW0XT4,"LG Leather Replacement Battery Rear Back Door Cover Case For LG G4, H815, H811, H810, VS986, VS999, US991, F500, LS991 -  Metallic Gray (Plastic)",[],"B017AKLO4S,B00WI4LO8I,B00X0X32RW,B01I1N7IGG,B00Y2P8QHI,B00X0X2ZCA,B01DW2XLGM,B013XQZ39U,B015S551MI,B015GS69NC,B01N9P1713,B01774WPQ8,B01ECZTYBY,B01G8LN88U,B011JA0P2W,B00X0X32WM,B01N017PCB,B00X0X37P4,B016DTFN58,B01KA0BSZ0,B01N6V9OYV,B01GUZ1WEG,B00X0X32P4,B00X0X37G8,B07CHZ8S29,B00YBYNQZM,B00YQ2NXHA,B00V51QOXA,B06W2G1CQ5,B00ZHW0Y5W,B013V34GNE,B00VXP8SZA,B01CS5EDLG,B013SPEFSG,B00XVLY434,B015EOD9KO,B06WRV5D7M,B06X6BDNDQ,B01MUDW1P9,B00WSZ3B74,B01BW6QEMI,B00XJS2O0E,B00X0X2ZOI,B01DW2XMYS,B00WSZ3AE8,B00XCQIRRC,B01MR4OLO3,B06XJFDTN7",,LG,Cell Phones & Accessories,"Cases, Holsters & Sleeves",Basic Cases,,0.77825
268,B00ZHW0XIK,"LG Leather Replacement Battery Rear Back Door Cover Case For LG G4, H815, H811, H810, VS986, VS999, US991, F500, LS991 -  Red Leather","['100% Genuine Leather from Manufactured by LG Replacement of original battery cover Genuine leather coated on the outer surface Made with vegetable tanned Full-Grain Leather For At&amp;amp;T, T-Mobile, Verizon, and all US Cellular LG G4s &amp;nbsp;']","B017AKLO4S,B013V34GNE,B01KA0BSZ0,B01N95SOFQ,B015EOD9KO,B00V51QOXA,B01N9P1713,B01DW2XLGM,B06X6BDNDQ,B01EFXX8CO,B00XJS2O0E,B01BW6QEMI",,LG,Cell Phones & Accessories,"Cases, Holsters & Sleeves",Basic Cases,,0.8335
269,B0109I9W24,"Spigen S350 Designed for Apple Watch Stand with Night Stand Mode for Series 4 / Series 3 / Series 2 / Series 1 / 44mm / 42mm / 40mm / 38mm, Patent Pending - Black","[""Spigen's S350 Apple Watch Stand is made entirely of scratch-free TPU for minimal aesthetics packed with smart functionality. It features a bottom lip that cradles your watch on its side for stability that prevents your watch from swaying side to side. An exact charger cutout offers form-fitting precision that keeps things simple and easy to use.""]","B07J9PVJFM,B07HX5X9FN,B07HXDDVB9,B078LR9JQ4,B07HSS4KYJ,B07DN716HQ,B07CXZ7K51,B07B1P676N,B07HMJ84CZ,B07HMFNZQD,B07HCNHYGW,B07MHYFMNX,B07HSS8JDV,B07KLPPP3W,B07HQSPX8C,B07HR5YK7T,B07H2HQV37,B00UVSNQPM,B0718WTFFB,B07HC9RM8N,B07M9Z7XJ2,B07H24TD79,B07K3HLMTF,B07HNZGB3Q,B076Z31HQ5,B01LYA40G9,B0798GNZPV,B06XYGPVHX,B07J41757Y,B07L2RX2NZ,B07JYV9WB4,B077NNNSMF,B07F9RDMHY,B078PVQFJV,B07HCH6F8R,B07JZ69XJ9,B07MHV444C,B074748GCW,B07C2KNRJ5,B07BSFSXS8,B078SMZMR4,B075FJT3FK,B07L6VB7JL,B019IO50C6,B07K77DWN9,B07GFJHD3T,B07F85KF74,B0753Z4PGC,B07HKLJFVY,B07HQRP3JR,B076YSDBBH,B07GZHHXXZ,B072KS25ZB,B07DYCJ1CM,B0117MD8NA,B015MSKC98,B07HSZT7P2,B07HNWGJF9,B07JGL524R,B07F33WPVM,B075XLFTSB,B07D4D4GCT,B0795DZFQV,B07MGWPCBG,B01N74P26H,B078YR748N,B07D6LSHLH,B074ZJ8XK2,B07675YS5H,B07MGVTSKR,B07FTRKB7T,B00VSGVVNA,B071KWF6RT,B07DXXK4MW,B07GN5SSGP,B07DBXNV58,B07K39FRSL,B07MC6GQSF,B077D118JY,B07477GRGX,B07GXK6B5R,B07HBZ15V7,B07HSSDV4S,B01GP2JRSC,B07DNS8RJH,B075WMWQM3,B078MXNNHW,B07JY1MG73,B07HSK96MZ,B01EY9TY5E,B07HC9ZL7H,B07H4N23S5,B07JCTY9XZ,B07L2XJFGR",,Spigen,Cell Phones & Accessories,Accessories,Smartwatch Accessories,,0.89145
270,B010MU4YSG,"Supershieldz for LG G Pad X8.3/X 8.3 Tempered Glass Screen Protector, Anti-Scratch, Anti-Fingerprint, Bubble Free, Lifetime Replacement Warranty",[],"B012EFP2M4,B0169NF75O,B013FAN1RA,B01N21SXUJ,B00J5E0ZOS,B01D32K4GQ,B00IT41IA0,B00L7S0YNW,B01J5HAT72,B015YNCXHU,B01I97LJ1Y,B077HS1YFW,B00K3C8MPK,B00IOVUXL8,B00ZYO2JHO,B01C5EJVX0,B010Q2A2PE,B01HSV0NU0,B01N2VR5ME,B01EYK9KFM,B01DXUH0CO,B01BNYQKFA,B01IA04W8C,B06XYK7RG5,B012EFP8QO,B0742MTC6C,B0131N2IEI,B00WRB7INM,B07FFK9T4Q,B0761RDK33",,Supershieldz,Cell Phones & Accessories,Accessories,Screen Protectors,,0.8389
271,B010MVJ7SC,Spigen Neo Hybrid Carbon iPhone 6S Case with Carbon Fiber Design and Reinforced Hard Bumper Frame for iPhone 6S 2015 - Gunmetal,['Give your iPhone 6s the carbon fiber treatment with our Neo Hybrid Carbon case. The newly designed TPU shell sports a carbon fiber texture for the ultimate style while offering dual bumper protection with an upgraded PC frame for reinforced durability at the cutouts.'],"B010MVJ6NS,B01BCZRT1O,B00RH5X7NI,B010MVJM5K,B074Z51MBW,B01415QHYW,B07482P44X,B013J3CRGY,B01KBQ6I3A,B01GIWGAAC,B01GIVX7TA,B01E4U4X1I,B07482KWMS,B00012ZQ5Q,B01IIQ269U,B010MVR76Q,B010MVIZTE,B013TKNSIS,B00JH88BTI,B010MVJ124,B010MVIPA8,B010MVJ2YG,B00JH88GB6,B074CNF6YW",,Spigen,Cell Phones & Accessories,"Cases, Holsters & Sleeves",Basic Cases,,0.84585
272,B010MVJ124,Spigen Neo Hybrid iPhone 6S Case with Flexible Inner Protection and Reinforced Hard Bumper Frame for iPhone 6S 2015 - Metal Slate,['Spigens Neo Hybrid case gives your iPhone 6s reinforced bumper protection with a slim profile. The hard PC frame has been reinforced at the cutouts for sturdier usability and a better fit alongside the newly designed TPU pattern for functional protection and grip thats smart and stylish.'],"B01BCZRT1O,B07482KWMS,B010MVJ6NS,B07GFTCY4Z,B07GHJ2SRF,B074Z51MBW,B07482P44X,B01GIVXKUG,B01415QHYW,B013J3CRGY,B01CK0OBJS,B01KBQ6I3A,B00RH5X7NI,B07482R6VS,B01GIWH6H8,B01BEJBBSK,B01LXJ2J0C,B00EL94RQE,B074CMNSXV,B01GIVWOMG,B01BCZRW5C,B01E4U4X1I,B00U5M3BDQ,B00QN1T6NM,B013J3C73W,B07GFRT68S,B074CMZCZP,B07GDWVMYL,B07GHTC3X1,B00LL5DV9U,B00JH88GB6,B00JH88JDQ,B013VPPH9O,B015NLZKKU,B01AMGFY5M,B074CMWM9H,B010MVQJPQ","B00JH88GB6,B013J3C73W,B0141U0X6K,B0141U21G0,B00LL5DV9U,B015NLZKKU,B010MVJ4BM,B00JH88BTI,B00JH87ZSQ,B0141U25IY,B013J3CRGY,B010MVJDF4,B010MVJM5K,B00JH88D1O,B010MVJ5O8,B013TKNWPW,B010MVISUU,B010MVIPA8,B00LL6ZPXY,B00JH88JDQ,B00LL74Z9I,B010MVJS1I,B010MVQO6K,B013VPPH9O,B013TKNSIS,B012PKV30S,B010MVK0JW,B010MVIQKC,B0753CZGRT,B00LLGE436,B010MVQJPQ,B010MVRHGQ,B010MVJNTK,B00LL60JU8,B010MVRKTA,B013TKNNGK,B012PKFAQ6,B01I0PND78,B010MVQR08,B01MSTKRXQ,B010MVR76Q,B013VZE6XC,B00NSSX23I,B01IIQ269U,B01GUKEBU8,B013VPPJEM,B01DG1V3YG,B00LLGH4I8,B01BUIDZPW,B01I5XY3QU,B00PR9XE5C",Spigen,Cell Phones & Accessories,"Cases, Holsters & Sleeves",Basic Cases,,0.855375
273,B010MVQ4ME,Spigen Slim Armor iPhone 6S Plus Case with Kickstand and Air Cushion Technology Hybrid Drop Protection for iPhone 6S Plus 2015 - Rose Gold,"['The Spigen Slim Armor case is the slimmed down protective option for your iPhone 6s Plus. With Air Cushion Technology and a two-piece build, it delivers military-grade protection (MIL-STD 810G 516.6) for security against drops and impacts. Its unique style sets it apart from other bulky cases.']","B01BCZRW5C,B00U5M5XMS,B01H46NWI4,B01KLNJF7O,B071ZXVHP3,B00Q0CB88K,B075RVXWPF,B01JJLJC9K,B0752WHY2B,B014EB532U,B012PKFAQ6,B010MVQJPQ,B013TKNNGK,B013TKO0CG",,Spigen,Cell Phones & Accessories,"Cases, Holsters & Sleeves",Basic Cases,,0.7845500000000001
274,B010ON8XME,"Supershieldz for LG G Pad 7.0 / G Pad 7.0 LTE Tempered Glass Screen Protector, Anti-Scratch, Anti-Fingerprint, Bubble Free,Lifetime Replacement Warranty",[],"B00M1IETHE,B07D474QFJ,B07D52C2X6,B07D47STDP,B07D542NN3,B00OVWQR3W,B015GZDVM2,B073W9BX6Y,B00L9K3MVE,B00M6N2VPQ,B012MVPYDM,B06XYF94DC,B06XRHZP43,B01GXSNLX0,B06XYGTFX4,B06XRJ4GGF,B06XYD28K9,B01GQRE0LA,B016Y65IMS,B00L7EJ8OC,B014GZPKFE,B01GUZ2JQG,B01CUWLP68,B07D57BMV1,B014JPSEKO,B077VXN2B8,B01IBXFTQC",,Supershieldz,Cell Phones & Accessories,Accessories,,,0.840875
